"entity_type","bundle",deleted,entity_id,revision_id,"language",delta,"field_contemporary_disputes_value","field_contemporary_disputes_format"
"node","book",0,1974,1974,"und",0,"Kurzbesprechung: Jenaer Allgemeine Literaturzeitung, Januar 1811, S. 143","filtered_html"
"node","book",0,1997,1997,"und",0,"אייכל, איצק: דבר אל המדברים . המאסף, ג', אלול תקמ\"ו, עמ' ר\"ה-ר\"י","filtered_html"
"node","book",0,2018,2018,"und",0,"הספר עורר תגובות בקרב חברי הקהילה היהודי ת. התנגדו להצעות היהודים הספרדים, שהסתייגו מן הרעיון להיות קשורים לאשכנזים בעיני השלטונות, אך גם עניי האשכנזים, שהתנגדו להענקת כוח נוסף לעשירים על גורלם של העניים. 

Endelman, The Jews of Britain","filtered_html"
"node","book",0,2097,2097,"und",0,"כפי שפיינר מציין (מהפכת הנאורות, 367), ייתכן מאד כי ספר זה העניק השראה לאהרן וולפסון לחבר את \"השיחה בארץ החיים\" האנטי-קלריקלי ואנטי-רבני, ולהציג דעות סותרות לאלה המופיעים בספרו של יוסף האפרתי.","filtered_html"
"node","book",0,2125,2125,"und",0,"בעקבות <ins>דברי שלום ואמת</ins> קמה \"מלחמת תרבות\" בקרב יהדות אשכנז. פיינר, <ins>מהפכת הנאורות</ins>, עמ' 113 והלאה; 165 והלאה.
גם השלטונות נטלו חלק בויכוח סביב הספר. שר ההשכלה הפרוסי צדליץ התעניין בפרשה (פיינר, שם, עמ' 167). 
בויכוחים סביב הספר היו מעורבים גם אינטלקטואלים לא יהודים. כך למשל אוגוסט קראנץ (פיינר, שם, עמ' 178 והלאה).","filtered_html"
"node","book",0,2191,2191,"und",0,"<ins>מאמר אמרה צרופה</ins> עורר גל של התנגדות. על החיבורים שהתפרסמו בעקבותיו ראו: מכמן, <ins>יהדות הולנד</ins>, עמ' 167, הערה 31.","filtered_html"
"node","book",0,2336,2336,"und",0,"התייחסות לספר וכן חלוקי דעות על דברים שנכתבו בו - בתוך ספרו של מאיר פירדא <strong>שלמות וצורת הנפש</strong>. בסעיף על שכר ועונש בספרו כותב פירדא: \"כבר כתבו הראשוני' והאחרוני'? [כך!] הרבה מענין הנבואה ובפרט רבנו הגדול הרמ\"בם בספרו יד החזקה ובספרו מורה הנבוכים, <ins>גם ביארו הטיב ענין זה, מתרגמי תרי עשר הם המה מורי ילדי בני ישראל פה בהקדמתם סלת למנחה</ins>, עד ששפת יתר בענין זה יהי' אך לגרעון, אמנם את זה ראיתי <ins>להוסיף על דבריהם</ins>, שהאמנת השגחת ה' על ברואיו קודם להאמונת הנבואה וכבר הוכיח הרב בעל העקרים אמת ההשגחה, ואני אוסף על דבריו ולבארם יותר...\"
ואח\"כ: \"והנה כבר כתבו הראשוני' והאחרוני' מענין הנבואה מפועלה תכליתה וצורתה, <ins>כל זה ביארו הטיב החכמי' הנ\"ל בהקדמתם הנ\"ל אמנם מה שאמרו מן חומר הנבואה אין דעתי נוחה</ins> הימנו כי לדעתי לא שייך לומר חומר על דבר רוחני, אמנם בפועל הנבואה כולם שהודו במציאותה מסכימים שפועלה הוא השם יתעל' המשפיע שפע להנביא...","filtered_html"
"node","book",0,2343,2343,"und",0,"ראו פיינר, מהפכת הנאורות, עמ' 310 והלאה.

לפי סמט, ר' שאול ברלין, \"הספר הוליד חמישה מכתבים כהגנה עליו. על שלושה מהם חתום ר\"ש 
ברלין ועל שניים - עובדיה בן ברוך.\" (עמ' 432)

כך: <strong>פסק דין</strong> מכבוד אדונינו מורנו ורבנו הגאון המפורסם החכם הכולל מהו' צבי הירש נר\"ו, על דבר החרם על ספר <ins><strong>מצפה יקתאל</strong></ins>, י\"ב טבת תקנ\"א (חינוך נערים).","filtered_html"
"node","book",0,2360,2360,"und",0,"החיבור \"קונטרס קורי עכביש\" בא \"להציל את נפשו [של הנאו] ממוקשי משיגיו אשר השיגו על ספר צוהר התיבה שחבר והיתה כל מגמתם לבטל את דבריו...\"","filtered_html"
"node","book",0,2361,2361,"und",0,"בספרו  <ins>עט סופר החדש</ins> משנת 1829, מבקר המחבר צמח סגל לנדא איש וילנא את הספר <ins>צחות המליצה</ins>. שני הספרים עוסקים אמנם בנושא דומה, ושניהם מכילים אגרות, אך לנדא מבקר את הסגנון הבארוקי של בוכנר, שהוא לדעתו סגנון ימי ביניים מיושן, שאינו תורם להחייאתה של השפה העברית כלשון הספרות בתקופת ההשכלה וגם לא כלשון מדוברת. זהר, עוללות מבציר, עמ' 26.","filtered_html"
"node","book",0,2366,2366,"und",0,"לפי סמט, ר' שאול ברלין, עמ' 431, מיד עם צאתו, עורר הספר חשש כי לא רק ההגהות, כי אם גם חלקי הטקסט הקדומים כביכול לא היו אלא מעשה ידיו של שאול ברלין. דברים שנאמרו בספר גבלו ממש באנטינומיה. ראשון יצא נגדו תלמיד חכם בשם וולף לנדסברגר, בקונטרס <ins>זאב יטרוף</ins> (פרנקפורט דאודר, תקנ\"ג). אחריו יצא נגד הספר ר' מרדכי בנט (רב המדינה במורביה), ור' רפאל כהן וקרוביו פתחו במערכה נגד הספר ונגד המחבר.
אביו ר' צבי הירש יצא להגנתו ודחה האשמות בנוגע למקוריות השו\"ת.","filtered_html"
"node","book",0,2385,2385,"und",0,"מיד עם צאתו גרם ספר זה לסערה ולקרע בין משכילי פראג לבין עורכי \"המאסף\". קסטנברג-גלדשטיין, עמ' 134-135; פיינר, מהפכת הנאורות.","filtered_html"
"node","book",0,2453,2453,"und",0,"ספר זה עורר ויכוח בין העוסקים בתחיית הספרות העברית על איכויותיו ומעלותיו.","filtered_html"
