"entity_type","bundle",deleted,entity_id,revision_id,"language",delta,"field_personal_addresse_notes_value","field_personal_addresse_notes_format"
"node","book",0,1962,1962,"und",0,"לאחר דברי ההקדמה, ישנה פניה בת שני עמודים אל \"האזרח גרגואר\".","filtered_html"
"node","book",0,2022,2022,"und",0,"Friedrich Wilhelm II. König von Preußen.","filtered_html"
"node","book",0,2052,2052,"und",0,"Probst Teller","filtered_html"
"node","book",0,2056,2056,"und",0,"אמנם תחילה אין פניה ישירה למלך החדש, אך בהמשך עולה ישנה <ins>פניה עקיפה</ins>. לקראת סוף הנאום, כותב וייזל (כשהוא משווה, כפי שעשה לכל אורך הספר, בין מלכות ישראל למלכותו של המלך בתקופתו): \"...כמו שכתוב וגם ישב שלמה על כסא מלוכה, וגם באו עבדי המלך לברך את אדונינו המלך דוד לאמר ייטב אלהיך את שם שלמה משמך, ויגדל את כסאו מכסאך, וישתחו המלך על המשכב (מ\"א א' מ\"ו מ\"ז). וככה נאמר אנחנו ייטיב אלהים את שם אדונינו המלך פרידריך ווילהעלם יר\"ה משם המלך דודו שהלך לעולמו, ויגדל את כסאו מכסא המלך המת\". (הקבלה זו אינה מועברת בתרגום הגרמני.)
שתי הפסקאות האחרונות בסיום הספר <ins>פונות במפורש אל המלך החדש</ins>: \"אשריך ווילהעלם מלכנו, כי מלבד מורא כבודך אשר אנו חייבים לך, שלחה גם אהבתך פארותיה בלבנו. זאת נחלת הולך תמים וזאת פרי צדקתו. / וצדקתך זאת תמלא לבבינו תקוה טובה, כי תנהלנו בטובך כאשר תנהל כל יושבי ארצך, כי מלך חכם אתה, וידעת כי אל אחד בראנו ואב אחד לכלנו, והוא ישפות שלום על כל מעשה ידיו. אמן:\"
מוזכרת גם אלמנתו של המלך, וכן המלכה החדשה.","filtered_html"
"node","book",0,2150,2150,"und",0,"מיד לאחר עמוד השער, ישנו שיר באיטלקית הפותח במילים:
All' Inclita Familia Itzig","filtered_html"
"node","book",0,2156,2156,"und",0,"ב\"מכתב\" לדוד פרידלנדר, פרידריכספלד מבקש ממנו: \"הגד לבני עירך, ובראש לטובים ולישרים בלבותה, אשר עשו חסד עם אבותי צ\"ע ועמדי. כי אהבתם לנצח עצורה בקרבי. וביחוד לזרע השר <strong>ר' פייטל</strong> ז\"ל...\" (עמ' 5)","filtered_html"
"node","book",0,2178,2178,"und",0,"המחבר פונה אל שני המשכילים ומבקר אותם בחריפות.","filtered_html"
"node","book",0,2231,2231,"und",0,"בכותרת ההקדמה","filtered_html"
"node","book",0,2234,2234,"und",0,"בראשית הספר ישנה \"אזכרת אהבה\" המוקדשת \"לידיד נפשי תלמידי ורעי, ה\"ה הבח' החתן המופלג פאר ילדי ישרון כ\"ה יוסף ראטיבאר\".","filtered_html"
"node","book",0,2239,2239,"und",0,"בתחילת הספר ישנו \"מכתב המחבר\" בו וייזל מברך את אמו (ואת אביו ז\"ל), וכותב לה \"כי אשת חיל את, ויראת ה' היא אוצרך, לא נטשתי תורתך ולא מאסתי חוסרך יסרתני בנעורי, עתה ראי ריח בכך כריח הלבנון, קומי נא אמי ושתי מיין מסכתי למען תברכני נפשך\".","filtered_html"
"node","book",0,2296,2296,"und",0,"השיר בהקדמת הספר מופנה אל בני הזוג יורש, אשר אימצו את ברי\"ל אל ביתם מגיל צעיר.","filtered_html"
"node","book",0,2297,2297,"und",0,"שיר אשר בפתח הספר נושא הכותרת: \"מכתם לדוד\". הוא  מוקדש לדוד פרידלענדר ובין היתר מהלל את הקשר בינו לבין משה מנדלסון ומרמז למעמדו כממשיכו של המורה הדגול.","filtered_html"
"node","book",0,2298,2298,"und",0,"בראשית הספר ישנו \"מכתב\" הפונה אל יצחק אייכל. ברי\"ל מתייחס שם למכתב שאייכל עצמו הפנה אליו בראש ספרו <ins>תולדות רבנו החכם...</ins>","filtered_html"
"node","book",0,2337,2337,"und",0,"מיד לאחר ההסכמות, מקדיש המחבר שני עמודים (תחת הכותרת <ins>מנחת מרחשת</ins>) להבעת תודה והוקרה ל<ins>שמואל ווערטהיים</ins>.","filtered_html"
"node","book",0,2343,2343,"und",0,"אחרי דברי הקדמתם, מוסיפים המביאים לדפוס את הדברים הבאים:
\"ואלה שמות ראשי אלפי ישראל הנודעים בשערינו אשר אליהם אנו שולחים הספר הזה...
לכבוד אדונינו מורינו ורבינו הגאון המפורסם, מוה\"רר צבי הירש נ\"י ולכבוד בנו הגאון מוה\"רר שאול נ\"י.
ולכבוד הגאונים המפורסמים רבני קהלות קדושות 
פראג 
אמשטרדם 
פ\"פ דמיין 
הנובר 
ברעסלוי 
גלויגא ליסא 
פוזנא 
מיינץ 
הייצפ'עלד 
פ\"פ דאודר 
ולהגאון החסיד המפורסם מוה\"רר אליה מווילנא.
ולהם ערוכים הדברים האלה אשר הצבנו בפתיחת שער הספר הזה, כמכתב שלוח לכל אחד בפרט למען אשר יראו כל איש ישראל כי בצדק כל אמרי פינו: אנחנו עבדים לה' ולתורתו האמתית ולכל חפיצי אמת וצדק.
ברלין ר\"ח אדר תקמ\"ט לפ\"ק
איצק בר\"ד מברלין    דוד פ'רידלענדר\"","filtered_html"
"node","book",0,2374,2374,"und",0,"ההקדמה הפותחת את הספר הוקדשה על ידי שנאבר-לויזון למלך שוודיה, גוסטב השלישי","filtered_html"
"node","book",0,2385,2385,"und",0,"בפתח הספר פונה יהודה ייטלש אל אחיו ברוך, מחבר הספר.","filtered_html"
"node","book",0,2404,2404,"und",0,"פרידריכספלד מעניק ערך רב לדעתו המקצועית של יעקב ששפורטס (המכונה כאן \"שש הדלתות\", שהוא תרגום שמו), כמי שאמון על רזי השפה ומסוגל לשפוט אותו כהוגן. בפנייתו אליו כותב: \"לכם לבד... המשפט, להגיד אם מצא השיר הזה חן בעיניכם ואם אין, כי אתם ידעתם לערוך את ערכו, היגביה שבת ואם חך הוא ועל גחונו ילך...\"","filtered_html"
"node","book",0,2411,2411,"und",0,"יעקב חי חפץ מצויין בדף שמסומן כדף י', ומופיע שיר מספד לכבודו.

אורי מורפורגי מצויין בדף שמסומן יח', וזהו שיר לרגל חתונתו עם רבקה.

יצחק מרפורגו מוזכר בדף שמסומן כיט', וזהו שיר לרגל הולדת לו 3 בנות עם אשתו מלכה.","filtered_html"
"node","book",0,2421,2421,"und",0,"לינדא פונה פנייה נרגשת לרעו ליב סג\"ל ומבטא את רחשי הידידות כלפיו. הוא מציין את שמו של אביו של ידידו - התורני... זלמן סג\"ל.

ליב במהר\"ז סג\"ל, אגענט בחצר בן המלך מענגללאנד הרצאג פאן יארק, Hannover","filtered_html"
"node","book",0,2461,2461,"und",0,"בטקסט עצמו יש פנייה לאליה החתן ולמרים הכלה. המידע עליהם לקוח מ-
M. Steinschneider, Die Handschriften-Verzeichnisse der Koeniglichen Bibliothek zu Berlin ... hebraeischen Handschriften, Berlin, 1878-1897, no. 255/5, p. 110.","filtered_html"
"node","book",0,2462,2462,"und",0,"אחרי עמוד השער מופיעה פניה: \"אל כבוד החכם המובהק התורני כ\"ה דוד פרידלענדר נרו בברלין\".","filtered_html"
"node","book",0,2473,2473,"und",0,"ראו הקדמה - אייכל פרסם את מכתבו לרעו ברי\"ל","filtered_html"
