"entity_type","bundle",deleted,entity_id,revision_id,"language",delta,"field_new_edition_type_notes_value","field_new_edition_type_notes_format"
"node","book",0,2077,2077,"und",0,"הדפסה ראשונה של מכתבים ששלח משה מנדלסון לעורך, אביגדור לוי, בתוספת הערות.","filtered_html"
"node","book",0,2162,2162,"und",0,"הדפסת אגרותיו של מנדלסון אל אביגדור לוי (חלק ב') בתוספת הערות.","filtered_html"
"node","book",0,2166,2166,"und",0,"כפי שכותב המתרגם והעורך בהקדמתו: \"דאמיט דיזע מיינע איבערזעצונג ניכט נאך איממר אן פ'ילן ארטן דונקל בליייבן מעגע, פ'ערזאה איך דיאזעלבע מיט טהעאלאגיש- פ'הילאזאפ'הישן אנמערקונגן...\"","filtered_html"
"node","book",0,2283,2283,"und",0,"המביא לדפוס הדפיס כתב יד מאת דודו, ישראל זמושץ, כשלושים שנה לאחר כתיבתו. לדברי המביא לדפוס, להוציא שני יוצאים מן הכלל, לא התפתה לתקן דבר מנוסח כתב היד של הפרשן. 
כמו כן, כלול גם הטקסט המקורי של הכוזרי.","filtered_html"
"node","book",0,2302,2302,"und",0,"לתרגום הוסיף וייזל פירוש ארוך, \"רוח חן\".
וכן הוא הוסיף שלוש הקדמות, כולל דיון על זהות המחבר המקורי של הספר.","filtered_html"
"node","book",0,2326,2326,"und",0,"ראו אצבע בחלון קהל יעד ותרגום. כמו כן:
וולפסון מציין בהקדמתו כי בביאור שלו לא נהג כמרבית קודמיו, דהיינו, לא התמקד ב\"ענייני דיקדוק  יבשים\", שרק מגדילים את כמות הדפים בספר ומייקרים אותו, אך אין בהם כל תועלת.","filtered_html"
"node","book",0,2327,2327,"und",0,"ראו חלון זה בספר מלכים א'.","filtered_html"
"node","book",0,2335,2335,"und",0,"דברי באור קצרים","filtered_html"
"node","book",0,2370,2370,"und",0,"הספר \"הסתובב\" כנראה בקרב קהל מסוים. המחבר שלמה בן משה כותב בהסכמתו/הקדמתו כי בידי דובנא היה \"העתק  מספר שערי נעימה אשר חברתי בילדותי ... בא אלי ובקש מאתי שאתן לו רשות להדפיס המחברת הלז...\"","filtered_html"
"node","book",0,2428,2428,"und",0,"המתרגם מסביר בהקדמתו (עמ' [7]) כי דברי המבוא שהוא מביא \"אויס דען ריינען קוועללען יאקאב,ס קיזוועטער,ס אז\"ו שעפפ'טעט\", וכי הוא \"אין איינעם פאפולערען געמיינניטציגען געוואנדע היעלטע, אונד דעם מלות ההגיון אנווענדבאר מאכטע\".
הוא גם מוביא הסבר על המושגים המופיעים בספר (כוח המחשבה, החושים, האנסטינקט, ועוד).","filtered_html"
